{
  "schema_version": "1.0",
  "record_id": "co-v1:fixture:flow:udp-001",
  "source_record_id": "CfixtureUdp001",
  "observation_type": "flow",
  "telemetry_source": "zeek",
  "sensor_id": "sensor-fixture-01",
  "observed_at": "2026-08-30T10:01:01Z",
  "quality": {
    "fidelity": "exact",
    "truncated": false,
    "loss_detected": false
  },
  "provenance": {
    "input_mode": "pcap_file",
    "parser_name": "ingestion_core-zeek-normalizer",
    "parser_version": "fixture-1"
  },
  "data": {
    "start_time": "2026-08-30T10:01:00Z",
    "end_time": "2026-08-30T10:01:00.050000Z",
    "src_ip": "192.0.2.30",
    "dst_ip": "203.0.113.53",
    "src_port": 53000,
    "dst_port": 53,
    "ip_protocol": 17,
    "direction_mode": "originator_responder",
    "service": "dns",
    "counters": {
      "src_to_dst": {
        "packets": 1,
        "payload_bytes": 31,
        "ip_bytes": 59
      },
      "dst_to_src": {
        "packets": 1,
        "payload_bytes": 47,
        "ip_bytes": 75
      }
    }
  }
}
