{
  "schema_version": "1.0",
  "record_id": "co-v1:fixture:dns:without-ports-001",
  "observation_type": "dns",
  "telemetry_source": "zeek",
  "sensor_id": "sensor-fixture-01",
  "observed_at": "2026-08-30T12:02:01Z",
  "quality": { "fidelity": "exact", "truncated": false, "loss_detected": false },
  "provenance": {
    "input_mode": "pcap_file",
    "parser_name": "ingestion_core-zeek-normalizer",
    "parser_version": "fixture-1"
  },
  "data": {
    "event_time": "2026-08-30T12:02:00Z",
    "src_ip": "192.0.2.92",
    "dst_ip": "203.0.113.53",
    "ip_protocol": 17,
    "query": "portless.example.test",
    "qtype": 1,
    "qclass": 1,
    "rcode": 0
  }
}
