{
  "schema_version": "1.0",
  "record_id": "co-v1:fixture:tls:001",
  "source_record_id": "CfixtureTcp001",
  "observation_type": "tls",
  "telemetry_source": "zeek",
  "sensor_id": "sensor-fixture-01",
  "observed_at": "2026-08-30T10:00:02.000001Z",
  "quality": {
    "fidelity": "exact",
    "truncated": false,
    "loss_detected": false
  },
  "provenance": {
    "input_mode": "pcap_file",
    "parser_name": "ingestion_core-zeek-normalizer",
    "parser_version": "fixture-1"
  },
  "data": {
    "event_time": "2026-08-30T10:00:01.100000Z",
    "flow_record_id": "co-v1:fixture:flow:tcp-001",
    "src_ip": "192.0.2.10",
    "dst_ip": "198.51.100.20",
    "src_port": 49152,
    "dst_port": 443,
    "ip_protocol": 6,
    "version": "TLSv1.3",
    "cipher": "TLS_AES_128_GCM_SHA256",
    "server_name": "service.example.test",
    "ja3": "0123456789abcdef0123456789abcdef",
    "ja3s": "fedcba9876543210fedcba9876543210"
  }
}
