{
  "schema_version": "1.0",
  "record_id": "co-v1:fixture:dns:query-without-codes-001",
  "observation_type": "dns",
  "telemetry_source": "zeek",
  "sensor_id": "sensor-fixture-01",
  "observed_at": "2026-08-30T12:01:01Z",
  "quality": { "fidelity": "exact", "truncated": false, "loss_detected": false },
  "provenance": {
    "input_mode": "pcap_file",
    "parser_name": "ingestion_core-zeek-normalizer",
    "parser_version": "fixture-1"
  },
  "data": {
    "event_time": "2026-08-30T12:01:00Z",
    "src_ip": "192.0.2.91",
    "dst_ip": "203.0.113.53",
    "src_port": 53002,
    "dst_port": 53,
    "ip_protocol": 17,
    "query": "partial.example.test"
  }
}
