{
  "schema_version": "1.0",
  "record_id": "co-v1:fixture:http:001",
  "source_record_id": "CfixtureHttp001",
  "observation_type": "http",
  "telemetry_source": "zeek",
  "sensor_id": "sensor-fixture-01",
  "observed_at": "2026-08-30T10:05:02Z",
  "quality": {
    "fidelity": "exact",
    "truncated": false,
    "loss_detected": false
  },
  "provenance": {
    "input_mode": "pcap_file",
    "parser_name": "ingestion_core-zeek-normalizer",
    "parser_version": "fixture-1"
  },
  "data": {
    "event_time": "2026-08-30T10:05:01.250000Z",
    "src_ip": "192.0.2.60",
    "dst_ip": "198.51.100.60",
    "src_port": 51000,
    "dst_port": 80,
    "ip_protocol": 6,
    "method": "GET",
    "host": "www.example.test",
    "uri": "/fixture",
    "user_agent": "SIH-contract-fixture/1.0",
    "status_code": 200,
    "request_body_bytes": 0,
    "response_body_bytes": 128
  }
}
