{
  "schema_version": "1.0",
  "record_id": "co-v1:fixture:flow:icmp-001",
  "observation_type": "flow",
  "telemetry_source": "zeek",
  "sensor_id": "sensor-fixture-01",
  "observed_at": "2026-08-30T12:03:01.123456Z",
  "quality": { "fidelity": "exact", "truncated": false, "loss_detected": false },
  "provenance": {
    "input_mode": "pcap_file",
    "parser_name": "ingestion_core-zeek-normalizer",
    "parser_version": "fixture-1"
  },
  "data": {
    "start_time": "2026-08-30T12:03:00.000001Z",
    "end_time": "2026-08-30T12:03:00.500000Z",
    "src_ip": "192.0.2.93",
    "dst_ip": "198.51.100.93",
    "icmp_type": 8,
    "icmp_code": 0,
    "ip_protocol": 1,
    "direction_mode": "originator_responder",
    "counters": {
      "src_to_dst": { "packets": 1, "ip_bytes": 84 },
      "dst_to_src": { "packets": 1, "ip_bytes": 84 }
    }
  }
}
